{
  "schema": "geetorus.question_adapter_fixture.v1",
  "adapter": "acpx",
  "nativeRequest": {
    "method": "elicitation/create",
    "params": {
      "mode": "form",
      "message": "Deployment input",
      "requestedSchema": {
        "type": "object",
        "title": "Deployment input",
        "required": ["environment"],
        "properties": {
          "environment": {
            "type": "string",
            "title": "Environment",
            "description": "Where should we deploy?",
            "oneOf": [
              {
                "const": "staging",
                "title": "Staging",
                "description": "Deploy to staging first."
              },
              {
                "const": "production",
                "title": "Production",
                "description": "Deploy directly to production."
              }
            ]
          }
        }
      }
    }
  },
  "canonicalQuestionSet": {
    "schema": "geetorus.question_set.v1",
    "title": "Deployment input",
    "submitLabel": "Submit answers",
    "questions": [
      {
        "id": "field-1-environment-ba5285161ba6",
        "header": "Environment",
        "prompt": "Where should we deploy?",
        "required": true,
        "answerMode": "single_select",
        "options": [
          {
            "id": "option-1",
            "label": "Staging",
            "description": "Deploy to staging first."
          },
          {
            "id": "option-2",
            "label": "Production",
            "description": "Deploy directly to production."
          }
        ]
      }
    ]
  },
  "canonicalResponse": {
    "schema": "geetorus.question_response.v1",
    "answers": {
      "field-1-environment-ba5285161ba6": {
        "selectedOptionIds": ["option-1"]
      }
    }
  },
  "nativeResponse": {
    "action": "accept",
    "content": {
      "environment": "staging"
    }
  }
}
